{
  "protocol": "MIF-SUITE-FINALIZATION/1",
  "status": "ready-for-independent-adapter-pin",
  "baseline": {
    "repository": "https://github.com/calcitem/mill-interchange-format.git",
    "branch": "master",
    "suiteCandidateCommit": "3ee7e57c7d4c7208be91f62914f344a587fb0f70",
    "wireCommit": "7e45d5a3fa970a535ed6a8a8ff5981aba4b9c978",
    "ci": {
      "workflow": "MIF verification",
      "runId": 31139940388,
      "url": "https://github.com/calcitem/mill-interchange-format/actions/runs/31139940388",
      "conclusion": "success"
    },
    "suite": {
      "path": "mif-suite-1.0.json",
      "rawSha256": "sha256:088ca33234289b06d9276aa4c430758222aa85d61621dee7bef4bfc6dcc069a4",
      "jcsSha256": "sha256:81a5feabc281bfc4f830addabc2c6846d1f191bbbcf04e548f04b35dd358ae6f"
    },
    "releaseManifest": {
      "path": "release/mif-1.0-release-manifest.json",
      "rawSha256": "sha256:b721cb2bd22e404ef2cac1ff570c7ea4d0b4859c97cbaba94a8acce241a00057",
      "status": "awaiting-adapter-suite-pin"
    },
    "artifactIndex": {
      "path": "artifacts/mif-1.0/index.json",
      "rawSha256": "sha256:5acbb714bed77e24eaac72fa5f24d2e54d1e17aaf568a8b60718c840281a6541"
    },
    "deterministicCorpus": {
      "path": "interop/cases/deterministic-v1.json",
      "rawSha256": "sha256:d11317a090300f8a47f77afed647bdbd236dcdb1996c0147a81c874fa39dfd82",
      "cases": 58
    },
    "differentialLaunch": {
      "path": "interop/differential-candidate-4-v1.json",
      "rawSha256": "sha256:560ef369fde248bd96d3468a4336442db1d970ede04f488821509e69925fd48e",
      "seededRuns": 10,
      "mutationFamilies": 5
    },
    "license": {
      "path": "LICENSE",
      "rawSha256": "sha256:c71d239df91726fc519c6eb72d318ec65820627232b2f796219e87dcf35d0ab4",
      "spdx": "Apache-2.0"
    }
  },
  "requiredClasses": [
    "identity",
    "key",
    "position",
    "replay",
    "ruleset",
    "transform"
  ],
  "rulesets": [
    "sha256:173caf8189defd1ab7d4a3e8b9e26688a07fd77976bf09d56bff5fe0c273e1a1",
    "sha256:224f7e368e322a4cc8c1225a025fb548d5b41eb096d34b7ae0543182d1aa9393"
  ],
  "projects": [
    {
      "id": "nmm-llm",
      "adapter": "nmm-llm-python",
      "repository": "https://github.com/benmarkbrandwood-blip/NMM_LLM.git",
      "branch": "dev",
      "implementationCommit": "6c1538082fc551203d827782d137a5799c810535",
      "independentEvidenceCommit": "382eddd1c5a3364c0056e152b524f517d126a113",
      "requiredOutcome": "suite-bound-evidence-pushed"
    },
    {
      "id": "sanmill",
      "adapter": "sanmill-rust",
      "repository": "https://github.com/calcitem/Sanmill.git",
      "branch": "master",
      "implementationCommit": "ae9a1d8a16261478631a3a7583cbf35c7b6e0df5",
      "independentEvidenceCommit": "9431b95f151502f415f096c7d96ca944e5d578de",
      "threeProjectEvidenceCommit": "2a53a89893daae528af64503cc87e34bf07e66e3",
      "requiredOutcome": "suite-bound-evidence-pushed"
    }
  ],
  "requiredEvidence": {
    "protocol": "MIF-SUITE-ADAPTER-EVIDENCE/1",
    "classification": "exact-for-tested-domain",
    "suiteConformance": true,
    "unexplainedDifferences": 0,
    "deterministicCases": 58,
    "differentialRuns": 10,
    "mutationFamilies": 5,
    "requiredFields": [
      "adapter",
      "artifactIndexRawSha256",
      "capabilityRawSha256",
      "deterministicReportRawSha256",
      "differentialReportRawSha256",
      "evidenceCommit",
      "implementationCommit",
      "mifCommit",
      "rulesetSemanticDigests",
      "suiteJcsSha256",
      "suiteRawSha256",
      "testedClasses"
    ]
  },
  "trainingGate": {
    "engineeringSmoke": "allowed-with-candidate-suite-and-experiment-digest",
    "longRunningArchival": "requires-signed-tag-and-two-suite-bound-adapters",
    "currentDecision": "not-yet-authorized"
  }
}
